{
  "$schema": "https://json-schema.org/draft/2020-12/schema",
  "$id": "https://raw.githubusercontent.com/pseudozach/lightning-pay-kit/main/packages/core/src/data/providers.schema.json",
  "title": "Lightning Pay Kit provider database",
  "type": "object",
  "additionalProperties": false,
  "required": [
    "$schema",
    "schemaVersion",
    "updatedAt",
    "directorySources",
    "providers"
  ],
  "properties": {
    "$schema": {
      "const": "./providers.schema.json"
    },
    "schemaVersion": {
      "const": 1
    },
    "updatedAt": {
      "type": "string",
      "pattern": "^\\d{4}-\\d{2}-\\d{2}$",
      "format": "date"
    },
    "providers": {
      "type": "array",
      "minItems": 1,
      "items": {
        "$ref": "#/$defs/provider"
      }
    },
    "directorySources": {
      "type": "array",
      "minItems": 1,
      "items": {
        "$ref": "#/$defs/directorySource"
      }
    }
  },
  "$defs": {
    "provider": {
      "type": "object",
      "additionalProperties": false,
      "required": [
        "id",
        "name",
        "aliases",
        "capabilitySummary",
        "lightningModes",
        "category",
        "custody",
        "platforms",
        "regions",
        "action",
        "serviceStatus",
        "verificationStatus",
        "lastVerifiedAt",
        "evidence",
        "accountRequired",
        "kycRequired"
      ],
      "properties": {
        "id": {
          "type": "string",
          "pattern": "^[a-z0-9]+(?:-[a-z0-9]+)*$"
        },
        "name": {
          "type": "string",
          "minLength": 1,
          "maxLength": 80
        },
        "aliases": {
          "type": "array",
          "maxItems": 12,
          "items": {
            "type": "string",
            "minLength": 1,
            "maxLength": 40
          }
        },
        "capabilitySummary": {
          "type": "string",
          "minLength": 45,
          "maxLength": 160
        },
        "lightningModes": {
          "type": "array",
          "minItems": 1,
          "maxItems": 4,
          "uniqueItems": true,
          "items": {
            "enum": [
              "custodial",
              "embedded_node",
              "exchange_withdrawal",
              "historical",
              "hosted_node",
              "native_lightning",
              "remote_node",
              "spark",
              "swap",
              "unknown"
            ]
          }
        },
        "category": {
          "enum": [
            "wallet",
            "payment_app",
            "exchange",
            "swap"
          ]
        },
        "custody": {
          "enum": [
            "custodial",
            "self_custodial",
            "configurable",
            "swap_based"
          ]
        },
        "platforms": {
          "type": "array",
          "minItems": 1,
          "uniqueItems": true,
          "items": {
            "enum": [
              "ios",
              "android",
              "web",
              "desktop",
              "extension"
            ]
          }
        },
        "regions": {
          "type": "object",
          "additionalProperties": false,
          "properties": {
            "scope": {
              "enum": [
                "global",
                "country_specific",
                "global_with_exclusions",
                "unknown"
              ]
            },
            "include": {
              "type": "array",
              "minItems": 1,
              "uniqueItems": true,
              "items": {
                "$ref": "#/$defs/countryCode"
              }
            },
            "exclude": {
              "type": "array",
              "minItems": 1,
              "uniqueItems": true,
              "items": {
                "$ref": "#/$defs/countryCode"
              }
            },
            "label": {
              "type": "string",
              "minLength": 1,
              "maxLength": 50
            },
            "notes": {
              "type": "string",
              "minLength": 1,
              "maxLength": 240
            }
          },
          "required": [
            "scope"
          ],
          "oneOf": [
            {
              "properties": {
                "scope": {
                  "const": "global"
                }
              },
              "not": {
                "anyOf": [
                  {
                    "required": [
                      "include"
                    ]
                  },
                  {
                    "required": [
                      "exclude"
                    ]
                  }
                ]
              }
            },
            {
              "properties": {
                "scope": {
                  "const": "country_specific"
                }
              },
              "required": [
                "include"
              ],
              "not": {
                "required": [
                  "exclude"
                ]
              }
            },
            {
              "properties": {
                "scope": {
                  "const": "global_with_exclusions"
                }
              },
              "required": [
                "exclude"
              ],
              "not": {
                "required": [
                  "include"
                ]
              }
            },
            {
              "properties": {
                "scope": {
                  "const": "unknown"
                }
              },
              "not": {
                "anyOf": [
                  {
                    "required": [
                      "include"
                    ]
                  },
                  {
                    "required": [
                      "exclude"
                    ]
                  }
                ]
              }
            }
          ]
        },
        "action": {
          "type": "object",
          "additionalProperties": false,
          "required": [
            "type",
            "url",
            "label"
          ],
          "properties": {
            "type": {
              "const": "copy_then_open"
            },
            "url": {
              "$ref": "#/$defs/httpsUrl"
            },
            "label": {
              "type": "string",
              "minLength": 1,
              "maxLength": 140
            }
          }
        },
        "serviceStatus": {
          "enum": [
            "active",
            "maintenance",
            "suspended",
            "retired",
            "unknown"
          ]
        },
        "verificationStatus": {
          "enum": [
            "verified",
            "needs_reverification",
            "unverified"
          ]
        },
        "lastVerifiedAt": {
          "type": "string",
          "pattern": "^\\d{4}-\\d{2}-\\d{2}$",
          "format": "date"
        },
        "evidence": {
          "type": "array",
          "minItems": 1,
          "items": {
            "type": "object",
            "additionalProperties": false,
            "required": [
              "url",
              "claim",
              "checkedAt"
            ],
            "properties": {
              "url": {
                "$ref": "#/$defs/httpsUrl"
              },
              "claim": {
                "type": "string",
                "minLength": 1,
                "maxLength": 300
              },
              "checkedAt": {
                "type": "string",
                "pattern": "^\\d{4}-\\d{2}-\\d{2}$",
                "format": "date"
              }
            }
          }
        },
        "accountRequired": {
          "type": "boolean"
        },
        "kycRequired": {
          "type": "boolean"
        }
      }
    },
    "directorySource": {
      "type": "object",
      "additionalProperties": false,
      "required": [
        "name",
        "url",
        "lastCheckedAt",
        "role",
        "limitations"
      ],
      "properties": {
        "name": {
          "type": "string",
          "minLength": 1,
          "maxLength": 120
        },
        "url": {
          "$ref": "#/$defs/httpsUrl"
        },
        "lastCheckedAt": {
          "type": "string",
          "pattern": "^\\d{4}-\\d{2}-\\d{2}$",
          "format": "date"
        },
        "sourceLastUpdatedAt": {
          "type": "string",
          "pattern": "^\\d{4}-\\d{2}-\\d{2}$",
          "format": "date"
        },
        "role": {
          "type": "string",
          "minLength": 1,
          "maxLength": 240
        },
        "limitations": {
          "type": "string",
          "minLength": 1,
          "maxLength": 500
        }
      }
    },
    "httpsUrl": {
      "type": "string",
      "format": "uri",
      "pattern": "^https://",
      "not": {
        "pattern": "^https://[^/]*@"
      }
    },
    "countryCode": {
      "type": "string",
      "enum": [
        "AD",
        "AE",
        "AF",
        "AG",
        "AI",
        "AL",
        "AM",
        "AO",
        "AQ",
        "AR",
        "AS",
        "AT",
        "AU",
        "AW",
        "AX",
        "AZ",
        "BA",
        "BB",
        "BD",
        "BE",
        "BF",
        "BG",
        "BH",
        "BI",
        "BJ",
        "BL",
        "BM",
        "BN",
        "BO",
        "BQ",
        "BR",
        "BS",
        "BT",
        "BV",
        "BW",
        "BY",
        "BZ",
        "CA",
        "CC",
        "CD",
        "CF",
        "CG",
        "CH",
        "CI",
        "CK",
        "CL",
        "CM",
        "CN",
        "CO",
        "CR",
        "CU",
        "CV",
        "CW",
        "CX",
        "CY",
        "CZ",
        "DE",
        "DJ",
        "DK",
        "DM",
        "DO",
        "DZ",
        "EC",
        "EE",
        "EG",
        "EH",
        "ER",
        "ES",
        "ET",
        "FI",
        "FJ",
        "FK",
        "FM",
        "FO",
        "FR",
        "GA",
        "GB",
        "GD",
        "GE",
        "GF",
        "GG",
        "GH",
        "GI",
        "GL",
        "GM",
        "GN",
        "GP",
        "GQ",
        "GR",
        "GS",
        "GT",
        "GU",
        "GW",
        "GY",
        "HK",
        "HM",
        "HN",
        "HR",
        "HT",
        "HU",
        "ID",
        "IE",
        "IL",
        "IM",
        "IN",
        "IO",
        "IQ",
        "IR",
        "IS",
        "IT",
        "JE",
        "JM",
        "JO",
        "JP",
        "KE",
        "KG",
        "KH",
        "KI",
        "KM",
        "KN",
        "KP",
        "KR",
        "KW",
        "KY",
        "KZ",
        "LA",
        "LB",
        "LC",
        "LI",
        "LK",
        "LR",
        "LS",
        "LT",
        "LU",
        "LV",
        "LY",
        "MA",
        "MC",
        "MD",
        "ME",
        "MF",
        "MG",
        "MH",
        "MK",
        "ML",
        "MM",
        "MN",
        "MO",
        "MP",
        "MQ",
        "MR",
        "MS",
        "MT",
        "MU",
        "MV",
        "MW",
        "MX",
        "MY",
        "MZ",
        "NA",
        "NC",
        "NE",
        "NF",
        "NG",
        "NI",
        "NL",
        "NO",
        "NP",
        "NR",
        "NU",
        "NZ",
        "OM",
        "PA",
        "PE",
        "PF",
        "PG",
        "PH",
        "PK",
        "PL",
        "PM",
        "PN",
        "PR",
        "PS",
        "PT",
        "PW",
        "PY",
        "QA",
        "RE",
        "RO",
        "RS",
        "RU",
        "RW",
        "SA",
        "SB",
        "SC",
        "SD",
        "SE",
        "SG",
        "SH",
        "SI",
        "SJ",
        "SK",
        "SL",
        "SM",
        "SN",
        "SO",
        "SR",
        "SS",
        "ST",
        "SV",
        "SX",
        "SY",
        "SZ",
        "TC",
        "TD",
        "TF",
        "TG",
        "TH",
        "TJ",
        "TK",
        "TL",
        "TM",
        "TN",
        "TO",
        "TR",
        "TT",
        "TV",
        "TW",
        "TZ",
        "UA",
        "UG",
        "UM",
        "US",
        "UY",
        "UZ",
        "VA",
        "VC",
        "VE",
        "VG",
        "VI",
        "VN",
        "VU",
        "WF",
        "WS",
        "XK",
        "YE",
        "YT",
        "ZA",
        "ZM",
        "ZW"
      ]
    }
  }
}
