{
  "$schema": "./providers.schema.json",
  "schemaVersion": 1,
  "updatedAt": "2026-10-19",
  "directorySources": [
    {
      "name": "LightningExchanges",
      "url": "https://github.com/theDavidCoen/LightningExchanges",
      "lastCheckedAt": "2026-09-29",
      "sourceLastUpdatedAt": "2025-10-02",
      "role": "Primary structured seed for exchanges claiming Lightning deposits and withdrawals.",
      "limitations": "Community-maintained; many proof links are old announcements and each candidate requires current first-party verification."
    },
    {
      "name": "Exchanges-With-LN",
      "url": "https://github.com/cointastical/Exchanges-With-LN",
      "lastCheckedAt": "2026-09-29",
      "sourceLastUpdatedAt": "2024-05-29",
      "role": "Broad discovery list covering exchanges, brokers, wallets, P2P markets, and swaps.",
      "limitations": "Stale and over-inclusive; listing does not by itself prove arbitrary external BOLT11 withdrawal."
    },
    {
      "name": "OpenReceive provider data v4",
      "url": "https://github.com/openreceive/openreceive/blob/master/packages/js/provider-data/src/data/openreceive-providers.v4.json",
      "lastCheckedAt": "2026-09-29",
      "sourceLastUpdatedAt": "2026-06-20",
      "role": "Current structured discovery data with provider tutorials and capability hints.",
      "limitations": "Discovery and corroboration only; every visible record still needs direct first-party evidence."
    },
    {
      "name": "Jameson Lopp Lightning resources",
      "url": "https://www.lopp.net/lightning-information.html",
      "lastCheckedAt": "2026-09-29",
      "sourceLastUpdatedAt": "2026-05-30",
      "role": "Maintained ecosystem meta-directory and dead-link cross-check.",
      "limitations": "Delegates exchange details to community lists and is not a provider capability matrix."
    },
    {
      "name": "Lightspark news and customer announcements",
      "url": "https://www.lightspark.com/news",
      "lastCheckedAt": "2026-09-29",
      "role": "Discovers newer exchange and financial-app Lightning integrations omitted by older directories.",
      "limitations": "Vendor partnerships, UMA, merchant receipt, and arbitrary consumer BOLT11 withdrawal are not equivalent."
    },
    {
      "name": "Lightsats wallet guide",
      "url": "https://github.com/lightsats/lightsats/blob/c9997c6fa2be0ecaa554229d574f4af9aa3229ac/app/lib/items/wallets.ts",
      "lastCheckedAt": "2026-10-19",
      "role": "Wallet discovery from Lightsats' official source; the hosted guide is currently unavailable.",
      "limitations": "Third-party names and lgt.st install links; does not establish current BOLT11 input or service state."
    },
    {
      "name": "DarthCoin Lightning wallet comparison",
      "url": "https://darth-coin.github.io/wallets/lightning-wallets-comparison-en.html",
      "lastCheckedAt": "2026-10-08",
      "sourceLastUpdatedAt": "2025-03-20",
      "role": "User-provided category/name discovery guide inspected first.",
      "limitations": "Community opinionated comparison; stale beta/classification claims. Its Spark link is legacy shesek remote-node software, not Spark L2. Its Muun custody claims are not first-party proof."
    }
  ],
  "providers": [
    {
      "id": "alby",
      "name": "Alby",
      "aliases": [
        "Alby Go",
        "Alby Hub"
      ],
      "category": "wallet",
      "custody": "self_custodial",
      "platforms": [
        "android",
        "ios",
        "web",
        "extension"
      ],
      "regions": {
        "notes": "Backend and availability depend on the user's setup.",
        "scope": "global",
        "label": "Global"
      },
      "action": {
        "type": "copy_then_open",
        "url": "https://getalby.com/alby-hub",
        "label": "Open Alby Lightning payment instructions"
      },
      "serviceStatus": "active",
      "verificationStatus": "verified",
      "lastVerifiedAt": "2026-09-29",
      "evidence": [
        {
          "url": "https://getalby.com/alby-hub",
          "claim": "Alby Hub is a self-custodial Lightning wallet for spending in apps, online, and in person.",
          "checkedAt": "2026-09-29"
        },
        {
          "url": "https://github.com/getAlby/hub",
          "claim": "The default backend is an embedded LDK node; external Lightning nodes are optional.",
          "checkedAt": "2026-09-29"
        }
      ],
      "accountRequired": false,
      "kycRequired": false,
      "capabilitySummary": "Pays Lightning invoices through Alby Hub or a connected Lightning node.",
      "lightningModes": [
        "embedded_node",
        "remote_node"
      ]
    },
    {
      "id": "aqua",
      "name": "AQUA",
      "aliases": [
        "Aqua Wallet"
      ],
      "category": "wallet",
      "custody": "self_custodial",
      "platforms": [
        "android",
        "ios"
      ],
      "regions": {
        "notes": "AQUA and its third-party swap services may impose geographic restrictions; complete searchable coverage is not established.",
        "scope": "unknown",
        "label": "Availability varies"
      },
      "action": {
        "type": "copy_then_open",
        "url": "https://aqua.net/",
        "label": "Open AQUA Lightning payment instructions"
      },
      "serviceStatus": "active",
      "verificationStatus": "verified",
      "lastVerifiedAt": "2026-09-29",
      "evidence": [
        {
          "url": "https://aqua.net/features",
          "claim": "AQUA documents self-custody, on-the-fly swaps, and Lightning payments using Liquid funds.",
          "checkedAt": "2026-09-29"
        },
        {
          "url": "https://github.com/AquaWallet/aqua-wallet",
          "claim": "The official wallet source implements current Lightning-to-Liquid swap flows.",
          "checkedAt": "2026-09-29"
        },
        {
          "url": "https://aqua.net/terms",
          "claim": "AQUA terms prohibit use in named sanctioned jurisdictions and warn third-party services may add geographic restrictions.",
          "checkedAt": "2026-09-29"
        }
      ],
      "accountRequired": false,
      "kycRequired": false,
      "capabilitySummary": "Swaps your Liquid balance to pay Lightning invoices.",
      "lightningModes": [
        "swap"
      ]
    },
    {
      "id": "arkade-wallet",
      "name": "Arkade Wallet",
      "aliases": [
        "Arkade"
      ],
      "capabilitySummary": "Swaps your Ark balance to pay fixed-amount Lightning invoices through an available solver.",
      "lightningModes": [
        "swap"
      ],
      "category": "wallet",
      "custody": "self_custodial",
      "platforms": [
        "web",
        "desktop"
      ],
      "regions": {
        "scope": "unknown",
        "label": "Availability varies",
        "notes": "Mainnet RFQ solver availability and quoted limits apply. Amountless BOLT11 is rejected. Country restrictions are not exhaustively verified."
      },
      "action": {
        "type": "copy_then_open",
        "url": "https://arkade.money/",
        "label": "Copy invoice, then open Arkade Wallet"
      },
      "serviceStatus": "active",
      "verificationStatus": "verified",
      "lastVerifiedAt": "2026-10-08",
      "evidence": [
        {
          "url": "https://arkade.money/assets/index-CycToh1w.js",
          "claim": "Live wallet bundle embeds commit 4860c047 and external invoice-to-RFQ send flow; it contains no Boltz payment client.",
          "checkedAt": "2026-10-08"
        },
        {
          "url": "https://github.com/arkade-os/wallet/blob/4860c0475aa2fd4f3dcf9ce4c1fa2aa68dbb272f/src/lib/lnSwap.ts#L46-L89",
          "claim": "Deployed-commit source decodes user-supplied BOLT11, checks network and expiry, and rejects zero-amount invoices before contacting a solver.",
          "checkedAt": "2026-10-08"
        },
        {
          "url": "https://github.com/arkade-os/wallet/blob/4860c0475aa2fd4f3dcf9ce4c1fa2aa68dbb272f/src/screens/Wallet/Send/Details.tsx#L168-L231",
          "claim": "Wallet funds the covenant in Ark VTXOs; solver pays the invoice and claims with preimage. Wallet tracks refund/settlement separately.",
          "checkedAt": "2026-10-08"
        },
        {
          "url": "https://github.com/arkade-os/wallet/blob/4860c0475aa2fd4f3dcf9ce4c1fa2aa68dbb272f/src/lib/beta-solver.card.json",
          "claim": "Bundled mainnet beta solver card advertises an Arkade-to-BOLT11 market, 500–50,000 sat Lightning limits and 30-bps fee; quotes are binding.",
          "checkedAt": "2026-10-08"
        }
      ],
      "accountRequired": false,
      "kycRequired": false
    },
    {
      "id": "belo",
      "name": "belo",
      "aliases": [],
      "category": "payment_app",
      "custody": "custodial",
      "platforms": [
        "android",
        "ios"
      ],
      "regions": {
        "notes": "Account and regional availability apply.",
        "scope": "country_specific",
        "include": [
          "AR",
          "BO",
          "BR",
          "CL",
          "CO",
          "EC",
          "MX",
          "PA",
          "PY",
          "PE",
          "UY",
          "VE"
        ],
        "label": "Latin America · 12 countries"
      },
      "action": {
        "type": "copy_then_open",
        "url": "https://help.belo.app/en/articles/5899323-how-to-withdraw-btc-from-belo-via-the-lightning-network",
        "label": "Open belo Lightning payment instructions"
      },
      "serviceStatus": "active",
      "verificationStatus": "verified",
      "lastVerifiedAt": "2026-09-29",
      "evidence": [
        {
          "url": "https://help.belo.app/en/articles/5899323-how-to-withdraw-btc-from-belo-via-the-lightning-network",
          "claim": "belo documents pasting or scanning an amount-specific Lightning invoice for withdrawal.",
          "checkedAt": "2026-09-29"
        },
        {